{
  "feedName": "health_ehc",
  "batchType": "provider",
  "header": {
    "recordType": "2",
    "description": "Provider Header Record",
    "fields": {
      "record_identifier": "2",
      "provider_number": "E00005306",
      "provider_office": "0006",
      "provider_surname": "LAIDLAW",
      "provider_first_name": "ALISON",
      "provider_name": "ALISON LAIDLAW",
      "provider_address_line_1": "6-825 THATCHER. DR E",
      "provider_address_line_2": "",
      "provider_address_line_3": "",
      "provider_city": "MOOSE JAW",
      "provider_province": "SK",
      "provider_country": "CAN",
      "provider_postal_code": "S6J0A9",
      "provider_telephone_number": "3066932303",
      "provider_language_flag": "E",
      "provider_eft_route_code": "",
      "provider_eft_account_number": ""
    }
  },
  "details": [
    {
      "recordType": "4",
      "description": "Claim Record (Paid)",
      "fields": {
        "record_identifier": "4",
        "trans_reference": "61021700728432",
        "trans_cross_reference": "",
        "office_sequence": "000001",
        "date_claim_received": "20260115",
        "date_processed_adjudicated": "20260115",
        "claim_status": "R",
        "client_language_flag": "E",
        "provider_number": "E00005306",
        "provider_surname": "LAIDLAW",
        "provider_first_name": "ALISON",
        "provider_office_location": "0006",
        "provider_province": "SK",
        "provider_software_vendor_code": "HL7",
        "provider_specialty": "OM",
        "pend_date": "00000000",
        "pending_reason": "",
        "client_last_name": "",
        "client_first_name": "",
        "patient_last_name": "LAYTON",
        "patient_first_name": "AUSTON",
        "patient_date_of_birth": "20070420",
        "sex_of_patient": "U",
        "carrier_id": "49",
        "gsas": "310138",
        "client_id": "670600",
        "patient_code": "",
        "patient_relationship_code": "0",
        "operator_id": "CAPSS_CD",
        "operator_code": "",
        "claim_submission_method": "1",
        "payee_code": "4",
        "payment_method": "2",
        "total_amt_claimed": "145.00",
        "adjustment_amount": "0.00",
        "adjustment_reason": "",
        "total_amt_paid": "0.00",
        "cda_acdq_error_codes": "011",
        "esi_messages": "011",
        "material_forwarded": "",
        "school_name": "",
        "secondary_coverage": "",
        "accident_date": "00000000",
        "predetermination_number": "",
        "line_of_business_code": "",
        "attachment_code": "",
        "letter_code": "",
        "general_code_gsas": "",
        "general_code_client": "",
        "distribution_code": "",
        "free_form_message": "",
        "number_of_service_codes_on_this_record": "01",
        "client_address_line_1": "",
        "client_address_line_2": "",
        "client_city": "",
        "client_province": "",
        "client_country": "",
        "client_postal_code": "",
        "override_indicator": "N",
        "supress_eob": "N",
        "submitted_line": "000001",
        "paid_line": "01",
        "service_status": "R",
        "adjudication_rule_number_applied": "00000",
        "frequency_rule_number_applied": "00000",
        "date_of_service": "20260115",
        "service_code": "VCE01",
        "service_name_eng": "EYE EXAM(S)",
        "service_name_fre": "EXAMEN(S) DE LA VUE",
        "tooth_code": "",
        "tooth_surface": "",
        "professional_fee_claimed": "145.00",
        "previously_paid_amount": "0.00",
        "professional_fee_eligible_amount": "0.00",
        "deductible_amount_professional_fee": "0.00",
        "professional_fee_benefit_amount": "0.00",
        "lab_service_code": "",
        "lab_fee_claimed": "",
        "eligible_amount_lab": "",
        "lab_deductible_amount": "",
        "lab_benefit_amount": "",
        "expense_service_code": "",
        "expense_claimed": "",
        "expense_eligible_amount": "",
        "expense_deductible_amount": "",
        "expense_benefit_amount": "",
        "cda_acdq_error_code": "011",
        "esi_messages_2": "011",
        "total_fees_claimed": "145.00",
        "coinsurance_amount": "0.00",
        "coinsurance_percentage": "000",
        "total_fees_paid": "0.00",
        "paid_service_code_1": "",
        "paid_service_code_2": "",
        "plan_number": "",
        "benefit_code": "",
        "category_code": "",
        "category_label_eng": "",
        "category_label_fre": "",
        "coverage_code_from_eligibility": "00",
        "carrier_dental_field": "",
        "service_code_source": "VIOM",
        "maximum_cutback_amount": "0.00",
        "rule_cutback_amount": "0.00",
        "fee_guide_amount": "0.00",
        "end_of_occurs": null
      }
    },
    {
      "recordType": "4",
      "description": "Claim Record (Paid)",
      "fields": {
        "record_identifier": "4",
        "trans_reference": "61021700728433",
        "trans_cross_reference": "",
        "office_sequence": "000001",
        "date_claim_received": "20260115",
        "date_processed_adjudicated": "20260115",
        "claim_status": "A",
        "client_language_flag": "E",
        "provider_number": "E00005306",
        "provider_surname": "LAIDLAW",
        "provider_first_name": "ALISON",
        "provider_office_location": "0006",
        "provider_province": "SK",
        "provider_software_vendor_code": "HL7",
        "provider_specialty": "OM",
        "pend_date": "00000000",
        "pending_reason": "",
        "client_last_name": "",
        "client_first_name": "",
        "patient_last_name": "LAYTON",
        "patient_first_name": "AUSTON",
        "patient_date_of_birth": "20070420",
        "sex_of_patient": "U",
        "carrier_id": "49",
        "gsas": "310138    310138",
        "client_id": "670597",
        "patient_code": "103",
        "patient_relationship_code": "2",
        "operator_id": "CAPSS_CD",
        "operator_code": "",
        "claim_submission_method": "1",
        "payee_code": "4",
        "payment_method": "2",
        "total_amt_claimed": "145.00",
        "adjustment_amount": "0.00",
        "adjustment_reason": "",
        "total_amt_paid": "116.00",
        "cda_acdq_error_codes": "",
        "esi_messages": "",
        "material_forwarded": "",
        "school_name": "",
        "secondary_coverage": "",
        "accident_date": "00000000",
        "predetermination_number": "",
        "line_of_business_code": "",
        "attachment_code": "",
        "letter_code": "",
        "general_code_gsas": "",
        "general_code_client": "",
        "distribution_code": "",
        "free_form_message": "",
        "number_of_service_codes_on_this_record": "01",
        "client_address_line_1": "PO BOX 733",
        "client_address_line_2": "",
        "client_city": "KERROBERT",
        "client_province": "SK",
        "client_country": "CANADA",
        "client_postal_code": "S0L1R0",
        "override_indicator": "N",
        "supress_eob": "N",
        "submitted_line": "000001",
        "paid_line": "01",
        "service_status": "A",
        "adjudication_rule_number_applied": "00000",
        "frequency_rule_number_applied": "14265",
        "date_of_service": "20260115",
        "service_code": "VCE01",
        "service_name_eng": "EYE EXAM(S)",
        "service_name_fre": "EXAMEN(S) DE LA VUE",
        "tooth_code": "",
        "tooth_surface": "",
        "professional_fee_claimed": "145.00",
        "previously_paid_amount": "0.00",
        "professional_fee_eligible_amount": "145.00",
        "deductible_amount_professional_fee": "0.00",
        "professional_fee_benefit_amount": "116.00",
        "lab_service_code": "",
        "lab_fee_claimed": "",
        "eligible_amount_lab": "",
        "lab_deductible_amount": "",
        "lab_benefit_amount": "",
        "expense_service_code": "",
        "expense_claimed": "",
        "expense_eligible_amount": "",
        "expense_deductible_amount": "",
        "expense_benefit_amount": "",
        "cda_acdq_error_code": "",
        "esi_messages_2": "",
        "total_fees_claimed": "145.00",
        "coinsurance_amount": "29.00",
        "coinsurance_percentage": "080",
        "total_fees_paid": "116.00",
        "paid_service_code_1": "VCE01",
        "paid_service_code_2": "",
        "plan_number": "25007",
        "benefit_code": "21026",
        "category_code": "VC",
        "category_label_eng": "VISION CARE",
        "category_label_fre": "SOINS DE LA VUE",
        "coverage_code_from_eligibility": "31",
        "carrier_dental_field": "",
        "service_code_source": "VIOM",
        "maximum_cutback_amount": "0.00",
        "rule_cutback_amount": "0.00",
        "fee_guide_amount": "145.00",
        "end_of_occurs": null
      }
    }
  ],
  "trailer": {
    "recordType": "6",
    "description": "Provider Batch Control Record",
    "fields": {
      "record_identifier": "6",
      "record_count": "000004",
      "claim_amount": "116.00",
      "reversal_amount": "0.00",
      "adjustment_amount": "0.00",
      "total_amount_payable": "116.00"
    }
  },
  "metadata": {
    "detailCount": "2",
    "providerNumber": "E00005306"
  }
}
